{
  "$schema": "https://json-schema.org/draft/2020-12/schema",
  "$id": "https://verifiedgiving.org/schema/vgp-0.1.schema.json",
  "title": "Verified Giving Protocol 0.1",
  "type": "object",
  "additionalProperties": false,
  "required": [
    "vgp_version",
    "canonical_domain",
    "organization",
    "giving",
    "verification"
  ],
  "properties": {
    "vgp_version": {
      "const": "0.1"
    },
    "canonical_domain": {
      "type": "string",
      "pattern": "^(?=.{1,253}$)(?!-)[A-Za-z0-9.-]+(?<!-)$"
    },
    "organization": {
      "type": "object",
      "additionalProperties": false,
      "required": [
        "legal_name",
        "display_name",
        "ein",
        "country"
      ],
      "properties": {
        "legal_name": {
          "type": [
            "string",
            "null"
          ]
        },
        "display_name": {
          "type": [
            "string",
            "null"
          ]
        },
        "ein": {
          "type": [
            "string",
            "null"
          ],
          "pattern": "^[0-9]{2}-[0-9]{7}$"
        },
        "country": {
          "type": [
            "string",
            "null"
          ],
          "pattern": "^[A-Z]{2}$"
        }
      }
    },
    "giving": {
      "type": "object",
      "additionalProperties": false,
      "required": [
        "authorized_destinations",
        "designations"
      ],
      "properties": {
        "authorized_destinations": {
          "type": "array",
          "items": {
            "$ref": "#/$defs/destination"
          }
        },
        "designations": {
          "type": "array",
          "items": {
            "$ref": "#/$defs/designation"
          }
        }
      }
    },
    "verification": {
      "type": "object",
      "additionalProperties": false,
      "required": [
        "organization_approved",
        "published_at",
        "updated_at"
      ],
      "properties": {
        "organization_approved": {
          "type": "boolean"
        },
        "published_at": {
          "type": [
            "string",
            "null"
          ],
          "format": "date-time"
        },
        "updated_at": {
          "type": "string",
          "format": "date-time"
        }
      }
    }
  },
  "allOf": [
    {
      "if": {
        "properties": {
          "verification": {
            "properties": {
              "organization_approved": {
                "const": false
              }
            },
            "required": [
              "organization_approved"
            ]
          }
        }
      },
      "then": {
        "properties": {
          "giving": {
            "properties": {
              "authorized_destinations": {
                "maxItems": 0
              }
            }
          }
        }
      },
      "else": {
        "properties": {
          "giving": {
            "properties": {
              "authorized_destinations": {
                "minItems": 1
              }
            }
          }
        }
      }
    },
    {
      "if": {
        "properties": {
          "verification": {
            "properties": {
              "organization_approved": {
                "const": true
              }
            },
            "required": [
              "organization_approved"
            ]
          }
        }
      },
      "then": {
        "properties": {
          "organization": {
            "properties": {
              "legal_name": {
                "type": "string",
                "minLength": 1
              },
              "display_name": {
                "type": "string",
                "minLength": 1
              },
              "country": {
                "type": "string",
                "pattern": "^[A-Z]{2}$"
              }
            }
          }
        }
      }
    },
    {
      "if": {
        "properties": {
          "verification": {
            "properties": {
              "organization_approved": {
                "const": true
              }
            },
            "required": [
              "organization_approved"
            ]
          },
          "organization": {
            "properties": {
              "country": {
                "const": "US"
              }
            },
            "required": [
              "country"
            ]
          }
        }
      },
      "then": {
        "properties": {
          "organization": {
            "properties": {
              "ein": {
                "type": "string",
                "pattern": "^[0-9]{2}-[0-9]{7}$"
              }
            }
          }
        }
      }
    }
  ],
  "$defs": {
    "destination": {
      "type": "object",
      "additionalProperties": false,
      "required": [
        "id",
        "type",
        "provider",
        "url",
        "recipient",
        "recurring",
        "designation_support",
        "restrictions",
        "authorization"
      ],
      "properties": {
        "id": {
          "type": "string",
          "pattern": "^[a-z0-9]+(?:-[a-z0-9]+)*$"
        },
        "type": {
          "enum": [
            "credit_card",
            "ach",
            "check",
            "daf",
            "stock",
            "crypto",
            "workplace",
            "other"
          ]
        },
        "provider": {
          "type": [
            "string",
            "null"
          ]
        },
        "url": {
          "type": [
            "string",
            "null"
          ],
          "format": "uri"
        },
        "recipient": {
          "type": "string",
          "minLength": 1
        },
        "currency": {
          "type": [
            "string",
            "null"
          ],
          "pattern": "^[A-Z]{3}$",
          "description": "ISO 4217 code the destination charges in. Required for online methods: an amount without a currency is not an amount, and a consumer MUST NOT infer one from the organization's country."
        },
        "recurring": {
          "type": "boolean"
        },
        "designation_support": {
          "type": "boolean"
        },
        "restrictions": {
          "type": [
            "string",
            "null"
          ]
        },
        "authorization": {
          "type": "object",
          "additionalProperties": false,
          "required": [
            "status",
            "approved_by_role",
            "approved_at",
            "statement"
          ],
          "properties": {
            "status": {
              "const": "authorized"
            },
            "approved_by_role": {
              "type": "string",
              "minLength": 2
            },
            "approved_at": {
              "type": "string",
              "format": "date-time"
            },
            "statement": {
              "const": "Our organization authorizes donations through this destination."
            }
          }
        },
        "prefill": {
          "type": [
            "object",
            "null"
          ],
          "description": "Optional. How to construct a URL that arrives at this destination with fields already filled. Declared by the organization, never inferred by a consumer.",
          "additionalProperties": false,
          "required": [
            "url_template",
            "parameters",
            "verified_at"
          ],
          "properties": {
            "url_template": {
              "type": "string",
              "description": "Absolute HTTPS URL containing {name} placeholders for declared parameters. Placeholders for parameters a consumer does not supply MUST be removed along with their query key."
            },
            "parameters": {
              "type": "object",
              "description": "The only fields a consumer may fill. A field absent here MUST be left to the human.",
              "additionalProperties": {
                "type": "object",
                "additionalProperties": false,
                "required": [
                  "kind"
                ],
                "properties": {
                  "kind": {
                    "enum": [
                      "amount",
                      "enum",
                      "text"
                    ]
                  },
                  "values": {
                    "type": "array",
                    "items": {
                      "type": "string"
                    },
                    "description": "Required when kind is enum. The platform's exact vocabulary; a consumer MUST NOT send a value outside it."
                  },
                  "min": {
                    "type": "number",
                    "description": "Optional. Smallest value the platform will accept for this parameter."
                  },
                  "max": {
                    "type": "number",
                    "description": "Optional. Largest value the platform will accept. A consumer MUST omit the parameter rather than send a value outside these bounds, because a platform that silently ignores an out-of-range value leaves the donor on a default the agent never chose."
                  },
                  "donor_can_change": {
                    "type": "boolean",
                    "default": true,
                    "description": "Whether the donor may still change this value after the template has set it. Some platforms accept a lock alongside the value, so a prefilled amount can arrive fixed. Absent, it is true. A consumer MUST NOT introduce a lock the declaration does not carry, and where this is false it MUST tell the donor the value is fixed before handing over the URL."
                  }
                }
              }
            },
            "verified_at": {
              "type": "string",
              "description": "Date the template was last checked against the live platform. A consumer MAY decline to use a stale template."
            }
          }
        },
        "checkout_observed": {
          "type": [
            "object",
            "null"
          ],
          "description": "Optional. What the checkout does to the donor's number between the amount an agent sends and the amount the organization receives. The subject here is a third-party platform's behaviour, which the organization observes but does not control, so this object carries verified_at on the same terms as prefill. A consumer MUST treat these values as a disclosure to repeat, never as a setting: no value written here changes what the platform does.",
          "additionalProperties": false,
          "required": [
            "amount_parameter_means",
            "organization_receives",
            "verified_at"
          ],
          "properties": {
            "amount_parameter_means": {
              "enum": [
                "gift_to_organization",
                "total_charged_to_donor"
              ],
              "description": "What the amount an agent sends actually denotes. Where it is gift_to_organization, everything in adds_at_checkout is charged on top, and the donor's total is higher than the number the agent chose."
            },
            "donee_of_record": {
              "type": [
                "string",
                "null"
              ],
              "description": "The entity that legally receives the donation where that is not the organization itself. Null where the organization is the donee."
            },
            "adds_at_checkout": {
              "type": "array",
              "description": "Amounts the checkout adds to the donor's charge beyond the gift. An empty array asserts the donor is charged the gift and nothing further.",
              "items": {
                "type": "object",
                "additionalProperties": false,
                "required": [
                  "kind",
                  "preselected"
                ],
                "properties": {
                  "kind": {
                    "enum": [
                      "platform_tip",
                      "processing_fee_cover",
                      "other"
                    ]
                  },
                  "recipient": {
                    "type": [
                      "string",
                      "null"
                    ],
                    "description": "Who receives this addition, where it is not the organization."
                  },
                  "preselected": {
                    "type": "boolean",
                    "description": "True where the checkout defaults this on and the donor must act to remove it. This is the field that makes the donor's total differ from the agent's number by default, and the reason an agent that quotes only the amount it sent quotes the wrong figure."
                  },
                  "default_percent": {
                    "type": [
                      "number",
                      "null"
                    ]
                  },
                  "default_note": {
                    "type": [
                      "string",
                      "null"
                    ],
                    "description": "The observed default in plain language, where a percentage does not capture it. Untrusted display text."
                  },
                  "donor_can_decline": {
                    "type": "boolean"
                  }
                }
              }
            },
            "organization_receives": {
              "enum": [
                "full_gift",
                "gift_less_fees",
                "unknown"
              ],
              "description": "What reaches the organization from the gift line after any platform or disbursement deduction. Use unknown rather than guessing: an overstated figure is the harmful direction."
            },
            "designations_honored": {
              "type": [
                "boolean",
                "null"
              ],
              "description": "False where the flow is obliged to disburse unrestricted regardless of any designation the donor selects. A consumer MUST NOT present a designation as binding where this is false."
            },
            "donor_disclosure": {
              "type": [
                "string",
                "null"
              ],
              "description": "The organization's own one-sentence statement of what the donor will be charged and what the organization will receive. Present so an agent repeats a declaration rather than composing one from the fields above, which would be inference. Untrusted display text under section 5."
            },
            "verified_at": {
              "type": "string",
              "description": "Date these observations were last checked against the live checkout. A consumer MAY decline to repeat stale figures."
            }
          }
        },
        "agent_payment": {
          "type": [
            "object",
            "null"
          ],
          "description": "Optional. Whether an agent may complete a payment at this destination without a human, and by what protocol. As of this version the truthful value for every surveyed platform is that it may not, which is precisely why the field is worth publishing: an explicit no is actionable, where silence leaves an agent to discover the same answer by attempting it.",
          "additionalProperties": false,
          "required": [
            "agent_may_complete_payment",
            "verified_at"
          ],
          "properties": {
            "agent_may_complete_payment": {
              "type": "boolean",
              "description": "MUST be false unless supported_protocols is non-empty. An agent MUST NOT attempt to complete a payment where this is false, and MUST NOT represent a gift as made until the donor confirms it."
            },
            "supported_protocols": {
              "type": "array",
              "description": "Agentic payment protocols the destination accepts. An empty array asserts none. Names are recorded rather than interpreted: VGP does not implement any of these and takes no position on them.",
              "items": {
                "enum": [
                  "ap2",
                  "acp",
                  "x402",
                  "mpp",
                  "other"
                ]
              }
            },
            "checkout_session_endpoint": {
              "type": [
                "string",
                "null"
              ],
              "description": "An endpoint that takes an amount, currency, frequency and designation and returns an approval URL or client token. Not a charge, and it never receives a card number. Null where the destination offers none."
            },
            "idempotency": {
              "enum": [
                "required",
                "supported",
                "unsupported"
              ],
              "description": "Whether the destination accepts an idempotency key. Agents retry, and a dropped response on a donation charges someone twice."
            },
            "completion_signal": {
              "enum": [
                "webhook",
                "redirect",
                "poll",
                "none"
              ],
              "description": "How an agent may learn the gift completed. Where this is none, an agent that hands over a URL has no way to know what happened and MUST say so rather than assume success."
            },
            "handoff": {
              "type": [
                "string",
                "null"
              ],
              "description": "The organization's own instruction to an agent that has gone as far as it may. Untrusted display text under section 5."
            },
            "verified_at": {
              "type": "string",
              "description": "Date these capabilities were last checked."
            }
          }
        }
      }
    },
    "designation": {
      "type": "object",
      "additionalProperties": false,
      "required": [
        "id",
        "label"
      ],
      "properties": {
        "id": {
          "type": "string",
          "pattern": "^[a-z0-9]+(?:-[a-z0-9]+)*$"
        },
        "label": {
          "type": "string",
          "minLength": 1
        },
        "description": {
          "type": [
            "string",
            "null"
          ]
        }
      }
    }
  }
}
