{
  "vgp_version": "0.1",
  "canonical_domain": "example.org",
  "organization": {
    "legal_name": "Example Foundation",
    "display_name": "Example",
    "ein": "12-3456789",
    "country": "US"
  },
  "giving": {
    "authorized_destinations": [],
    "designations": []
  },
  "verification": {
    "organization_approved": false,
    "published_at": null,
    "updated_at": "2026-08-25T00:00:00Z"
  }
}
