{
  "vgp_version": "0.1",
  "canonical_domain": "powerpoetry.org",
  "organization": {
    "legal_name": "To Be Heard Foundation Inc",
    "display_name": "Power Poetry",
    "ein": "13-3648963",
    "country": "US"
  },
  "giving": {
    "authorized_destinations": [
      {
        "id": "givebutter-embed",
        "type": "credit_card",
        "provider": "Givebutter",
        "url": "https://www.powerpoetry.org/donate",
        "recipient": "To Be Heard Foundation Inc",
        "currency": "USD",
        "recurring": true,
        "designation_support": false,
        "restrictions": "All gifts through this destination are designated to the Power Poetry program and are received by To Be Heard Foundation Inc. The donor is not offered a choice of fund at checkout.",
        "authorization": {
          "status": "authorized",
          "approved_by_role": "Board Member, To Be Heard Foundation",
          "approved_at": "2026-08-28T21:16:22Z",
          "statement": "Our organization authorizes donations through this destination."
        },
        "prefill": {
          "url_template": "https://www.powerpoetry.org/donate?amount={amount}&frequency={frequency}",
          "parameters": {
            "amount": {
              "kind": "amount",
              "min": 1,
              "max": 999
            },
            "frequency": {
              "kind": "enum",
              "values": [
                "once",
                "monthly",
                "yearly"
              ]
            }
          },
          "verified_at": "2026-09-04"
        },
        "checkout_observed": {
          "amount_parameter_means": "gift_to_organization",
          "donee_of_record": null,
          "adds_at_checkout": [
            {
              "kind": "processing_fee_cover",
              "recipient": null,
              "preselected": true,
              "default_percent": null,
              "default_note": "Observed as $3.30 added to a $100 monthly gift, shown above the payment methods with a Change link beside it.",
              "donor_can_decline": true
            },
            {
              "kind": "platform_tip",
              "recipient": "Givebutter",
              "preselected": true,
              "default_percent": 15,
              "default_note": "A stepper defaulted to 15%, adjustable by the donor. The checkout displays no combined total, so the tip is not visible as a dollar figure before the payment method is chosen.",
              "donor_can_decline": true
            }
          ],
          "organization_receives": "full_gift",
          "designations_honored": null,
          "donor_disclosure": "To Be Heard Foundation receives your full gift. Givebutter’s checkout pre-selects a 15% tip to Givebutter and a processing-fee contribution on top of it, so a $100 monthly gift is charged at roughly $118.30 per month unless you change both.",
          "verified_at": "2026-09-04"
        },
        "agent_payment": {
          "agent_may_complete_payment": false,
          "supported_protocols": [],
          "checkout_session_endpoint": null,
          "idempotency": "unsupported",
          "completion_signal": "none",
          "handoff": "Prepare the URL and hand it to the donor. Givebutter offers no way for an agent to open a checkout session, no idempotency key, and no signal that a gift completed, so an agent MUST stop here and MUST NOT tell the donor the gift is made. If the donor wants confirmation, To Be Heard Foundation can confirm it at help@powerpoetry.org.",
          "verified_at": "2026-09-04"
        }
      }
    ],
    "designations": [
      {
        "id": "power-poetry",
        "label": "Power Poetry",
        "description": "Gifts earmarked for the Power Poetry program, received by To Be Heard Foundation Inc."
      }
    ]
  },
  "verification": {
    "organization_approved": true,
    "published_at": "2026-08-28T21:16:22Z",
    "updated_at": "2026-09-04T00:00:00Z"
  }
}
